{
  "$schema": "https://json-schema.org/draft/2020-12/schema",
  "$id": "urn:aidcf:schema:capability:1.1",
  "type": "object",
  "additionalProperties": false,
  "properties": {
    "id": {
      "type": "string"
    },
    "type": {
      "type": "string"
    },
    "version": {
      "const": "1.1"
    },
    "status": {
      "type": "string"
    },
    "classification": {
      "enum": [
        "INTERNAL",
        "CONFIDENTIAL"
      ]
    },
    "sourceArtifact": {
      "const": "AIDCF-015"
    },
    "name": {
      "type": "string"
    },
    "owner": {
      "type": "string"
    },
    "outcomes": {
      "type": "array",
      "minItems": 1,
      "items": {
        "type": "string"
      }
    },
    "boundary": {
      "type": "string"
    }
  },
  "required": [
    "id",
    "type",
    "version",
    "status",
    "classification",
    "sourceArtifact",
    "name",
    "owner",
    "outcomes",
    "boundary"
  ]
}
